BourbonID;Bourbon;Aged;Proof;Corn;Rye;Barley;Wheat;Type;Style;Price Range;Distillery;Location;Website;Description
evan12;Evan Williams 12-Year;12;101;78;10;12;0;Straight;;5;Heaven Hill Distillery;Kentucky;;"Only available overseas and at the Heaven Hill Distillery gift shop in Kentucky, this 12 year-old Evan Williams is 101 proof. For many years, this marque was an export-only bourbon, and only recently did this become available at the gift shop. While this bourbon is hard to find, it is worth seeking out during your next trip to Kentucky or overseas."
evan23;Evan Williams 23-Year;23;107;78;10;12;0;Straight;;5;Heaven Hill Distillery;Kentucky;;"Only available domestically at the Heaven Hill Bourbon Heritage Center, Evan Williams 23 year old is one of the oldest American whiskies on the market. Bottled at a robust 107 proof (53.5% abv), this bourbon features a deeper wood influence thanks to its long maturation period."
evan83;Evan Williams 1783;;86;78;10;12;0;Staight;Small Batch;2;Heaven Hill Distillery;Kentucky;https://evanwilliams.com/ew_bourbon.php?cta=ew-1783;"Evan Williams 1783 Small Batch honors the year that Evan Williams founded Kentucky’s First Distillery. This small batch Bourbon is pulled from less than 200 barrels. It’s extra-aged and uses the same sour mash process and traditional recipe made popular by our namesake."
evansingle;Evan Williams Single Barrel;;86.6;78;10;12;0;Straight;Single Barrel;2;Heaven Hill Distillery;https://evanwilliams.com/single-barrel.php?cta=single-barrel;"Evan Williams Single Barrel Bourbon is handcrafted and specially selected by our Master Distillers. A five-time winner of “Whiskey of the Year,” it’s our most premium and decorated Bourbon that measures up to exacting standards."
evanbond;Evan Williams Bottled-in-Bond;;100;78;10;12;0;Staright;Small Batch;1;Heaven Hill Distillery;Kentucky;https://evanwilliams.com/bottled-in-bond-bourbon.php?cta=bottled-in-bond;"Evan Williams Bottled-in-Bond is aged under government supervision and meeting the exact requirements for a Bottled-in-Bond Bourbon. It has all the kick you expect—but still goes down smooth."
ezrabrooks;Ezra Brooks;;90;78;10;12;0;;;1;Elza Brooks Distilling;Kentucky;https://ezrabrooks.com/whiskey/kentucky-straight-bourbon/;"It starts with genuine Kentucky sour mash. Then it’s aged the old-fashioned way, charcoal filtered, and bottled at an honest 90 proof. That’s straight-up authentic bourbon."
