BourbonID;Bourbon;Aged;Proof;Corn;Rye;Barley;Wheat;Type;Style;Price Range;Distillery;Location;Website;Description
bladebow22;Blade and Bow 22-Year-Old;22;91;0;0;0;0;Straight;Limited Edition;5;Stitzel-Weller Distillery;Kentucky;https://www.bladeandbowwhiskey.com/our-whiskies/blade-and-bow-22-year-old;"The award-winning Blade and Bow 22-Year-Old Kentucky Straight Bourbon Whiskey is a limited-release whiskey inspired by the passion and craftsmanship of the legendary Stitzel-Weller distillery. Blade and Bow 22-Year-Old was most recently aged and bottled at Stitzel-Weller Smooth and smoky, this limited-release bourbon’s taste is accented with notes of torched sugar and apples baked in honey and spices. Its aroma is one of toasted oak mixed with vanilla bean, fig and just a touch of caramel. Blade and Bow 22-Year-Old Kentucky Straight Bourbon Whiskey was named the “Best Straight Bourbon” and received the DOUBLE GOLD MEDAL at the 2015 San Francisco World Spirits Competition."
blantonsbarrel;Blanton's Staight from the Barrel;0;130;85;15;5;0;Straight;Single Barrel;3;Blanton's Distilling Co.;Kentucky;https://www.blantonsbourbon.com/straight_from_the_barrel;"Not only one of the world’s best bourbons, Blanton’s Straight from the Barrel is one of the world’s best whiskeys. Created for connoisseurs familiar with cask strength whiskeys, this enormous taste profile reaches depths of flavor found only in the rarest of spirits. The high alcohol by volume is intense and powerful yet inviting. The complexity of rye, caramel, oak, honey and vanilla coat your palate followed by a legendary finish. Straight from the barrel is best served neat or with a splash of water. Un-filtered, un-cut, unbelievable."
blantonsgold;Blanton's Gold Edition;0;103;85;15;5;0;Straight;Single Barrel;4;Blanton's Distilling Co.;Kentucky;https://www.blantonsbourbon.com/gold;"Blanton’s Gold Edition was created for discerning connoisseurs who appreciate exceptional smoothness and clean finish in their bourbon whiskey. The rich taste of dark fudge, citrus, oak and cream combined with the spiciness of white pepper and rye lead to a long finish that challenges the world’s finest single malts and rarest cognacs in complexity and character. Best served neat or with a splash of water. Bottled at 51% alcohol by volume."
blantonssingle;Blanton's Original Single Barrel;6;93;85;15;5;0;Straight;Single Barrel;3;Blanton's Distilling Co.;Kentucky;https://www.blantonsbourbon.com/original_single_barrel;"Taken from the center-cut or middle sections of the famous Warehouse H, Blanton’s Original was once designated for ambassadors, dignitaries, and Colonel Blanton’s family and friends. Today, everyone has access to the world’s first single barrel bourbon. The taste profile is sweet with citrus and oak. A creamy vanilla nose features hints of nuts, caramel, orange and light chocolate. Blanton’s Original set the standard for single barrel bourbons. Best served neat or on the rocks. 46% alcohol by volume."
blantonsspecial;Blanton's Special Reserve;0;80;85;15;5;0;Straight;Single Barrel;3;Blanton's Distilling Co.;Kentucky;https://www.blantonsbourbon.com/special;"Created as an introductory edition to our full lineup, Blanton’s Special Reserve is ideal for those new to single barrel bourbons. A sweet taste profile with a floral nose and light undertones of vanilla and citrus make it perfect for a premium cocktail or served on the rocks. 40% alcohol by volume."
bookers;Booker's;6;127;75;13;12;0;Straight;Small Batch;3;Jim Bean Small Batch Collection;Kentucky;www.bookersbourbon.com;"Booker’s Bourbon is a rare barrel-strength bourbon, bottled uncut and unfiltered*. But you obviously know a good bit about bourbon, because you don’t end up here by mistake. We don’t advertise. We don’t do social media. We just do bourbon. We focus on the sweet spot. The center of the rackhouse where the temperature and humidity stars align to create the deepest and most intense flavors. Once it’s aged to perfection, which always varies, the liquid is bottled uncut and unfiltered. We don’t add, we don’t water down, and we don’t apologize for it. For some people, it may be too much. But for true bourbon fans, it’s probably the best ever."
deluxe;Bourbon De Luxe;4;80;75;13;12;0;Straight;Traditional;1;Jim Bean;Kentucky;;"A four-year-old straight bourbon produced by Jim Beam at their distillery in Clermont, Kentucky. This young bourbon is versatile and can either be drunk neat, as part of a long drink or in cocktails."
breakenter;Breaking & Entering;5;86;0;0;0;0;Not Straight;Small Batch;3;St. George Spirits;Californiauch"With Breaking & Entering Bourbon, our plunder is your pleasure. To make B&E, St. George distillers Lance Winters and Dave Smith went deep into the rickhouses of Kentucky’s most venerable bourbon distilleries and brought several hundred barrels back to blend at our distillery in Alameda. The result? A criminally delicious bourbon with a storied Kentucky pedigree that would’ve been impossible for any one distillery to produce on its own."
breckenridge;Breckenridge;2;86;56;38;6;0;Blend;Small Batch;3;Breckenridge Distillery;Colorado;http://breckenridgedistillery.com/products-3/;"Deep honey-amber hue with warm, pronounced aromas of under-ripe banana and brown sugar, with spicy notes of white pepper and toasted sesame. Light body with warm texture and long sweet oak, vanilla finish with a touch of bitterness to balance. Reminiscent of a slice of toasted rye bread with honey drizzled on it. We mash, ferment and distill a lot of Bourbon in house. Our Blend of Straight Bourbon Whiskeys also consists of Barrels selected from Kentucky, Tennessee, and Indiana chosen for their unique qualities, heritage, and ability to marry in our blend, always made from a high-rye mash bill."
breckenridgesingle;Breckenridge Bourbon Single Barrel;2;86;56;38;6;0;Blend;Single Barrel;3;Breckenridge Distillery;Colorado;http://breckenridgedistillery.com/products-3/;"Every so often a barrel tasted for inclusion into our award winning Bourbon Whiskey Blend just expresses itself too individually to become part of the mix. These barrels we set aside for extended aging and when they reach their peak we hand bottle, sign and stamp these gems to release in extremely limited quantity. These bottles represent only the finest expression of Breckenridge Bourbon Whiskey. Rich, sumptuous top notes of toffee and caramel give way to clean burnt orange and butterscotch on the palate. Strong spicy undertones with a balanced oak profile and a fleeting hint of solvent-like ester notes, which manifest as banana peel and passion fruit. Long, reverberating finish carries the richness and balance of a classic Bourbon Whiskey"
brokenbell;Broken Bell;0;90;0;0;0;0;Not Straight;Small Batch;2;Distiller Sales Company;Minnesota;;"A solid small batch bourbon treating the drinker to dried fruit, vanilla, citrus and a bit of spice. This whiskey is bottled at 45% ABV. A young although solid sipper, this one also makes a great base for all your favorite cocktails."
buck;Buck;8;90;0;0;0;0;Straight;Small Batch;2;Frank-Lin Distillers;California;;"Buck 8 Year is sourced Kentucky straight bourbon bottled and distributed by independent bottler, Frank-Lin Distillers. This old fashioned sour mash whiskey was aged for 8 years in new American oak and bottled at 45% abv. The Kentucky distillery producing this whiskey remains unknown."
buffalo;Buffalo Trace;7;90;85;10;5;0;Straight;Traditional;2;Buffalo Trace Distillery;Kentucky;http://www.buffalotrace.com/our-bourbon.html;"Buffalo Trace Kentucky Straight Bourbon Whiskey is distilled, aged and bottled at the most award-winning distillery in the world. Made from the finest corn, rye and barley malt, this whiskey ages in new oak barrels for years in century old warehouses until the peak of maturity. The taste is rich and complex, with hints of vanilla, toffee and candied fruit. The smooth finish lingers on the palate. This will never change."
bulleit;Bulleit;6;90;68;28;4;0;Straight;Traditional;2;Stitzel-Weller Distillery;Kentucky;https://www.bulleit.com/whiskeys/bulleit-bourbon/;"Bulleit Bourbon is inspired by the whiskey pioneered by Augustus Bulleit over 150 years ago. Only ingredients of the very highest quality are used. The subtlety and complexity of Bulleit Bourbon come from its unique blend of rye, corn, and barley malt, along with special strains of yeast and pure Kentucky limestone filtered water. Due to its especially high rye content, Bulleit Bourbon has a bold, spicy character with a finish that's distinctively clean and smooth. Medium amber in color, with gentle spiciness and sweet oak aromas. Mid-palate is smooth with tones of maple, oak, and nutmeg. Finish is long, dry, and satiny with a light toffee flavor."
bulleit10;Bulleit 10-Year-Old;10;91;68;28;4;0;Straight;Small Batch;3;Stitzel-Weller Distillery;Kentucky;https://www.bulleit.com/whiskeys/bulleit-bourbon-10-year-old/;"Bulleit Bourbon 10 Year Old is Tom Bulleit’s selected reserve. Aged in charred American white oak, select Bulleit Bourbon barrels were set aside to age for 10 years. The result is a special expression of Bulleit that provides a rich, deep, incredibly smooth sipping experience."
burnsideoregron;Burnside Oregon Oaked Bourbon;4;96;75;10;15;0;Straight;Special Finish;3;Eastside Distilling;Oregon;https://www.eastsidedistilling.com/burnside-oregon-oaked-bourbon;"Eastside Distilling has been making craft spirits on Portland’s Distillery Row since its inception in 2008.  They put out a full range of spirits from rum to vodka to an award winning bourbon, which is the start of the Oregon Oaked Bourbon, the focus of this review. Yes, they took their four year old Gold Medal bourbon and put it back into barrels to age.  But not just any barrel would do, but new Oregon grown oak barrels for upwards of two additional months. This rounds out the spices in the bourbon, while adding a touch of oak to it. "
burnside;Burnside Bourbon;4;96;75;10;15;0;Straight;Small Batch;2;Eastside Distilling;Oregon;;"Burnside Bourbon will put sideburns on your face! Eastside Distilling’s Burnside Bourbon is a spicy, barrel-aged straight bourbon whiskey bottled at 96 proof – giving it more gusto than many of the other bourbons on the market."
burnsidegoose;Burnside Goose Hollow RSV Bourbon;4;92;75;10;15;0;Straight;Special Finish;3;Eastside Distilling;Oregon;https://www.eastsidedistilling.com/burnside-goose-hollow-rsv-bourbon;"Burnside Goose Hollow Reserve is a small batch expression of straight bourbon whiskies that are meticulously blended then aged for 45 days in Garryana Casks for a South meets West Bourbon unlike any other. Glorious Oregon Oak!"
